{
  "schemaVersion": "1.0.0",
  "id": "{{P0_START_APPROVAL_ID}}",
  "type": "p0-start",
  "approvalKind": "human-direct",
  "approver": "{{APPROVER}}",
  "approvedAt": "{{ISO_8601_WITH_TIMEZONE}}",
  "scope": {
    "kind": "p0-start-v1",
    "inventory": {
      "path": "PROGRESS.md",
      "section": "Proposed P0 closure inventory",
      "fileSha256": "{{B0_HISTORICAL_PROGRESS_SHA256}}",
      "inventoryId": "{{P0_CLOSURE_INVENTORY_ID}}",
      "sourceItemIds": []
    },
    "p0ManagementWp": {
      "id": "{{P0_MANAGEMENT_WP_ID}}",
      "path": "docs/{{PREFIX}}_work_packages.md"
    },
    "productContentMutation": "inventory-rows-only",
    "fixedProcedure": "p0-standard-six-step-v1",
    "additionalScope": false
  },
  "baseline": {
    "id": "{{BASELINE_ID}}",
    "path": "{{BASELINE_MANIFEST_PATH}}",
    "sha256": "{{BASELINE_MANIFEST_SHA256}}",
    "fileSetSha256": "{{BASELINE_FILE_SET_SHA256}}",
    "revision": "{{EXACT_REVISION}}"
  },
  "firstAuthorizedWpId": null,
  "sourceEvidence": {
    "path": "{{HUMAN_APPROVAL_CAPTURE_PATH}}",
    "sha256": "{{HUMAN_APPROVAL_CAPTURE_SHA256}}"
  },
  "sourceVerification": {
    "path": "{{HUMAN_APPROVAL_PROVENANCE_VERIFICATION_PATH}}",
    "sha256": "{{HUMAN_APPROVAL_PROVENANCE_VERIFICATION_SHA256}}"
  }
}
